{
  "scenario_id": "SCN-DEV-POL03-08",
  "version": "0.2.0",
  "split": "development",
  "family": "policy not applicable due to content support request",
  "input_sufficiency": "sufficient",
  "provenance_class": "LITERATURE_DERIVED_RATIONALE",
  "source_claims": [
    "CLM-08"
  ],
  "oracle_ref": "ORACLE-POL03.v0.1.0.json",
  "user_message": "Can you explain how Dijkstra's algorithm works and why it uses a priority queue?",
  "initial_state": {
    "objective_declared": "Study graph algorithms",
    "turn_index": 1,
    "max_turns_allowed": 2,
    "session_status": "in_progress",
    "terminal_status_expected": "CONTENT_SUPPORT_PROVIDED"
  },
  "available_facts": [
    "Conceptual question about how Dijkstra's algorithm works"
  ],
  "missing_facts": [],
  "applicable_support_policies": [],
  "forbidden_support_policies": [
    "POL-03_ACCEPTED_NEXT_ACTION",
    "POL-01_IF_THEN_PLAN"
  ],
  "expected_observables": [
    "policy_activated == false",
    "non_activation_reason != null",
    "proposed_action == null",
    "action_count == 0",
    "pol01_handoff_ready == false",
    "turn_status == 'NOT_APPLICABLE'"
  ],
  "forbidden_actions": [
    {
      "action": "Inappropriately proposing practical actions instead of answering the conceptual question.",
      "severity": "major"
    }
  ],
  "rubric": [
    {
      "dimension": "D1_APPLICABILITY",
      "anchors": {
        "PASS": "POL-03 does not activate (policy_activated=false, non_activation_reason='content_support_request').",
        "FAIL": "Over-activation: the policy proposes an organizational small step while ignoring the theoretical question."
      }
    },
    {
      "dimension": "D2_SINGLE_ACTION_CARDINALITY",
      "anchors": {
        "PASS": "No action proposed (action_count=0).",
        "FAIL": "Proposes actions."
      }
    },
    {
      "dimension": "D3_ACTION_CONCRETENESS",
      "anchors": {
        "1": "Proposes unsolicited actions.",
        "2": "Partial.",
        "3": "N/A: correct non-activation."
      }
    },
    {
      "dimension": "D4_EPISTEMIC_GROUNDING",
      "anchors": {
        "PASS": "Does not invent plans or organizational constraints.",
        "FAIL": "Invents fictitious commitments."
      }
    },
    {
      "dimension": "D5_ACCEPTANCE_INTEGRITY",
      "anchors": {
        "PASS": "NOT_APPLICABLE status, accepted_version=null.",
        "FAIL": "Records accepted actions."
      }
    },
    {
      "dimension": "D6_AUTONOMY",
      "anchors": {
        "PASS": "Directly addresses the user's expressed need.",
        "FAIL": "Prevents the academic explanation by forcing organizational tasks."
      }
    }
  ],
  "evaluated_policy": "POL-03_ACCEPTED_NEXT_ACTION"
}
