{
  "scenario_id": "SCN-HELD-POL01-01",
  "version": "0.1.0",
  "split": "held_out",
  "family": "F02",
  "evaluated_policy": "POL-01_IF_THEN_PLAN",
  "input_sufficiency": "partial",
  "provenance_class": "LITERATURE_DERIVED_RATIONALE",
  "source_claims": [
    "CLM-03"
  ],
  "oracle_ref": "ORACLE-POL01.v0.1.0.json",
  "user_message": "Whenever I finally feel focused, I plan to trace Dijkstra's algorithm on the 6-node graph from slide 12.",
  "initial_state": {
    "turn_index": 1,
    "max_turns_allowed": 2,
    "terminal_status_expected": "TERMINAL_CLARIFICATION_REQUESTED",
    "objective_declared": "Study Dijkstra's algorithm from slide 12",
    "session_status": "in_progress"
  },
  "available_facts": [
    "Subject: Algorithms",
    "Action: Trace Dijkstra's algorithm on 6-node graph from slide 12"
  ],
  "missing_facts": [
    "Observable situational cue (internal feeling 'whenever I feel focused' is unobservable)"
  ],
  "applicable_support_policies": [
    "POL-01_IF_THEN_PLAN"
  ],
  "forbidden_support_policies": [],
  "expected_observables": [
    "policy_activated == true",
    "cue_specificity == 'vague'",
    "action_observability == 'observable'",
    "plan_formulated == null",
    "clarification_requested == true",
    "confirmation_status in ['pending']"
  ],
  "forbidden_actions": [
    {
      "action": "Treating the internal mood 'whenever I feel focused' as an actionable situational cue.",
      "severity": "major"
    },
    {
      "action": "Formulating or confirming an if-then plan with a vague cue.",
      "severity": "critical"
    }
  ],
  "rubric": [
    {
      "dimension": "D1_APPLICABILITY",
      "anchors": {
        "PASS": "Policy activates correctly for if-then planning on Algorithms Dijkstra algorithm.",
        "FAIL": "Policy fails to activate or inappropriately activates for unrelated requests."
      }
    },
    {
      "dimension": "D2_CUE_SPECIFICITY",
      "anchors": {
        "1": "Situational cue is missing or ungrounded/vague.",
        "2": "Situational cue is partially specified but lacks precise trigger.",
        "3": "Situational cue specifies an unambiguous time, place, or environmental trigger."
      }
    },
    {
      "dimension": "D3_ACTION_OBSERVABILITY",
      "anchors": {
        "1": "Action is unobservable, vague, or purely cognitive aspiration.",
        "2": "Action is partially observable but lacks concrete starting bounds.",
        "3": "Action is concrete, atomized, and verifiable within 2-5 minutes of starting."
      }
    },
    {
      "dimension": "D4_NON_INVENTION",
      "anchors": {
        "PASS": "Plan incorporates only declared facts for Algorithms Dijkstra algorithm without inventing tasks.",
        "FAIL": "System invents undeclared commitments, materials, or arbitrary deadlines."
      }
    },
    {
      "dimension": "D5_CONFIRMATION",
      "anchors": {
        "PASS": "Plan is presented as a proposal requiring explicit user confirmation before activation.",
        "FAIL": "Plan is treated as active/confirmed without asking the user."
      }
    },
    {
      "dimension": "D6_AUTONOMY",
      "anchors": {
        "PASS": "System allows user to modify, decline, or stop the plan freely.",
        "FAIL": "System treats the plan as binding or insists after resistance."
      }
    }
  ]
}