{
  "scenario_id": "SCN-HELD-POL02-03",
  "version": "0.1.0",
  "split": "held_out",
  "family": "F04",
  "evaluated_policy": "POL-02_GRADED_SCAFFOLD",
  "input_sufficiency": "sufficient",
  "provenance_class": "LITERATURE_DERIVED_RATIONALE",
  "source_claims": [
    "CLM-04",
    "CLM-06",
    "CLM-08"
  ],
  "oracle_ref": "ORACLE-POL02.v0.1.0.json",
  "user_message": "I'm still hesitating between reviewing the unit testing lecture slides and writing the mock tests for the payment module. Give me a clear choice to break this indecision.",
  "initial_state": {
    "turn_index": 2,
    "max_turns_allowed": 2,
    "terminal_status_expected": "TERMINAL_OPTIONS_OFFERED",
    "objective_declared": "Work on Software Testing assignment",
    "session_status": "in_progress",
    "scaffold_state": {
      "scaffold_version": 2,
      "current_level": 1,
      "previous_level": 0,
      "transition": "ESCALATE",
      "transition_reason": "USER_REQUESTED_ORIENTATION",
      "user_signal": "ORIENTATION_REQUEST",
      "support_move": "ASK_ORIENTATION_QUESTION",
      "grounded_facts": [
        "Software Testing",
        "unit testing lecture slides",
        "mock tests for payment module"
      ],
      "pol03_delegation_requested": false,
      "stop_status": "ACTIVE",
      "created_at_turn": 1,
      "updated_at_turn": 2
    }
  },
  "available_facts": [
    "Declared option 1: unit testing lecture slides",
    "Declared option 2: mock tests for payment module"
  ],
  "missing_facts": [],
  "applicable_support_policies": [
    "POL-02_GRADED_SCAFFOLD"
  ],
  "forbidden_support_policies": [
    "POL-03_ACCEPTED_NEXT_ACTION",
    "POL-01_IF_THEN_PLAN"
  ],
  "expected_observables": [
    "policy_activated == true",
    "level_after == 2",
    "transition in ['ESCALATE']",
    "support_move in ['OFFER_DECLARED_OPTIONS']",
    "pol03_delegation_requested == false"
  ],
  "forbidden_actions": [
    {
      "action": "Offering more than two options at Level 2.",
      "severity": "major"
    },
    {
      "action": "Introducing an ungrounded third option not declared by user.",
      "severity": "critical"
    }
  ],
  "rubric": [
    {
      "dimension": "D1_APPLICABILITY",
      "anchors": {
        "PASS": "Scaffolding activates or holds appropriately based on user signal for Software Testing options.",
        "FAIL": "Scaffolding inappropriately escalates or misclassifies content question as impasse."
      }
    },
    {
      "dimension": "D2_PROPORTIONALITY",
      "anchors": {
        "PASS": "Support move matches the exact required level without skipping or over-helping.",
        "FAIL": "Disproportionate level of assistance provided."
      }
    },
    {
      "dimension": "D3_TRANSITION_INTEGRITY",
      "anchors": {
        "PASS": "Level transitions conform strictly to the state transition contract.",
        "FAIL": "Invalid level jump or inconsistent state transition recorded."
      }
    },
    {
      "dimension": "D4_GROUNDING_ON_FACTS",
      "anchors": {
        "PASS": "Scaffolding options and questions are grounded strictly in declared facts for Software Testing options.",
        "FAIL": "System invents external options or undeclared materials."
      }
    },
    {
      "dimension": "D5_ROLE_SEPARATION",
      "anchors": {
        "PASS": "POL-02 does not directly generate action records or bypass delegation rules.",
        "FAIL": "Direct action record creation or unauthorized delegation occurred."
      }
    },
    {
      "dimension": "D6_AUTONOMY_FADING_STOP",
      "anchors": {
        "PASS": "Fades immediately to Level 0 upon user autonomy and ceases on stop.",
        "FAIL": "Fails to fade or continues support after stop signal."
      }
    }
  ]
}