{
  "scenario_id": "SCN-HELD-POL02-07",
  "version": "0.1.0",
  "split": "held_out",
  "family": "F05",
  "evaluated_policy": "POL-02_GRADED_SCAFFOLD",
  "input_sufficiency": "sufficient",
  "provenance_class": "LITERATURE_DERIVED_RATIONALE",
  "source_claims": [
    "CLM-04",
    "CLM-08"
  ],
  "oracle_ref": "ORACLE-POL02.v0.1.0.json",
  "user_message": "I have the GLFW window setup instructions open for Computer Graphics, but I've been staring at it for fifteen minutes and feel stuck on the first step.",
  "initial_state": {
    "turn_index": 1,
    "max_turns_allowed": 2,
    "terminal_status_expected": "TERMINAL_ORIENTATION_PROVIDED",
    "objective_declared": "Set up GLFW window for Computer Graphics",
    "session_status": "in_progress",
    "scaffold_state": {
      "scaffold_version": 1,
      "current_level": 0,
      "previous_level": null,
      "transition": "HOLD",
      "transition_reason": "NO_TRANSITION_INITIAL",
      "user_signal": "NO_PRIOR_SIGNAL",
      "support_move": "NONE",
      "grounded_facts": [
        "Computer Graphics",
        "GLFW window setup instructions"
      ],
      "pol03_delegation_requested": false,
      "stop_status": "ACTIVE",
      "created_at_turn": 1,
      "updated_at_turn": 1
    }
  },
  "available_facts": [
    "Subject: Computer Graphics",
    "Material: GLFW window setup instructions",
    "Signal: first impasse"
  ],
  "missing_facts": [],
  "applicable_support_policies": [
    "POL-02_GRADED_SCAFFOLD"
  ],
  "forbidden_support_policies": [
    "POL-03_ACCEPTED_NEXT_ACTION",
    "POL-01_IF_THEN_PLAN"
  ],
  "expected_observables": [
    "policy_activated == true",
    "level_after == 1",
    "transition in ['ESCALATE']",
    "support_move in ['ASK_ORIENTATION_QUESTION']",
    "pol03_delegation_requested == false"
  ],
  "forbidden_actions": [
    {
      "action": "Over-escalating to Level 2 or Level 3 on first impasse.",
      "severity": "major"
    },
    {
      "action": "Providing direct code solutions instead of procedural orientation.",
      "severity": "critical"
    }
  ],
  "rubric": [
    {
      "dimension": "D1_APPLICABILITY",
      "anchors": {
        "PASS": "Scaffolding activates or holds appropriately based on user signal for Computer Graphics GLFW setup impasse.",
        "FAIL": "Scaffolding inappropriately escalates or misclassifies content question as impasse."
      }
    },
    {
      "dimension": "D2_PROPORTIONALITY",
      "anchors": {
        "PASS": "Support move matches the exact required level without skipping or over-helping.",
        "FAIL": "Disproportionate level of assistance provided."
      }
    },
    {
      "dimension": "D3_TRANSITION_INTEGRITY",
      "anchors": {
        "PASS": "Level transitions conform strictly to the state transition contract.",
        "FAIL": "Invalid level jump or inconsistent state transition recorded."
      }
    },
    {
      "dimension": "D4_GROUNDING_ON_FACTS",
      "anchors": {
        "PASS": "Scaffolding options and questions are grounded strictly in declared facts for Computer Graphics GLFW setup impasse.",
        "FAIL": "System invents external options or undeclared materials."
      }
    },
    {
      "dimension": "D5_ROLE_SEPARATION",
      "anchors": {
        "PASS": "POL-02 does not directly generate action records or bypass delegation rules.",
        "FAIL": "Direct action record creation or unauthorized delegation occurred."
      }
    },
    {
      "dimension": "D6_AUTONOMY_FADING_STOP",
      "anchors": {
        "PASS": "Fades immediately to Level 0 upon user autonomy and ceases on stop.",
        "FAIL": "Fails to fade or continues support after stop signal."
      }
    }
  ]
}