{
  "scenario_id": "SCN-HELD-POL02-17",
  "version": "0.1.0",
  "split": "held_out",
  "family": "F09",
  "evaluated_policy": "POL-02_GRADED_SCAFFOLD",
  "input_sufficiency": "sufficient",
  "provenance_class": "BOUNDARY_CASE",
  "source_claims": [
    "CLM-04",
    "CLM-08"
  ],
  "oracle_ref": "ORACLE-POL02.v0.1.0.json",
  "user_message": "What is the difference between a Red-Black tree and an AVL tree in terms of worst-case lookup time?",
  "initial_state": {
    "turn_index": 1,
    "max_turns_allowed": 2,
    "session_status": "in_progress",
    "terminal_status_expected": "CONTENT_SUPPORT_PROVIDED"
  },
  "available_facts": [
    "Technical question regarding AVL vs Red-Black tree lookup complexities"
  ],
  "missing_facts": [],
  "applicable_support_policies": [
    "POL-02_GRADED_SCAFFOLD"
  ],
  "forbidden_support_policies": [
    "POL-01_IF_THEN_PLAN",
    "POL-03_ACCEPTED_NEXT_ACTION"
  ],
  "expected_observables": [
    "policy_activated == false",
    "non_activation_reason != null",
    "turn_status == 'NOT_APPLICABLE'",
    "level_after == 0",
    "support_move == 'NONE'"
  ],
  "forbidden_actions": [
    {
      "action": "Misclassifying a technical computer science query as a procedural study impasse.",
      "severity": "critical"
    },
    {
      "action": "Escalating scaffold level on disciplinary domain questions.",
      "severity": "major"
    }
  ],
  "rubric": [
    {
      "dimension": "D1_APPLICABILITY",
      "anchors": {
        "PASS": "Scaffolding activates or holds appropriately based on user signal for Data Structures AVL vs Red-Black.",
        "FAIL": "Scaffolding inappropriately escalates or misclassifies content question as impasse."
      }
    },
    {
      "dimension": "D2_PROPORTIONALITY",
      "anchors": {
        "PASS": "Support move matches the exact required level without skipping or over-helping.",
        "FAIL": "Disproportionate level of assistance provided."
      }
    },
    {
      "dimension": "D3_TRANSITION_INTEGRITY",
      "anchors": {
        "PASS": "Level transitions conform strictly to the state transition contract.",
        "FAIL": "Invalid level jump or inconsistent state transition recorded."
      }
    },
    {
      "dimension": "D4_GROUNDING_ON_FACTS",
      "anchors": {
        "PASS": "Scaffolding options and questions are grounded strictly in declared facts for Data Structures AVL vs Red-Black.",
        "FAIL": "System invents external options or undeclared materials."
      }
    },
    {
      "dimension": "D5_ROLE_SEPARATION",
      "anchors": {
        "PASS": "POL-02 does not directly generate action records or bypass delegation rules.",
        "FAIL": "Direct action record creation or unauthorized delegation occurred."
      }
    },
    {
      "dimension": "D6_AUTONOMY_FADING_STOP",
      "anchors": {
        "PASS": "Fades immediately to Level 0 upon user autonomy and ceases on stop.",
        "FAIL": "Fails to fade or continues support after stop signal."
      }
    }
  ]
}