{
  "scenario_id": "SCN-HELD-INT-12",
  "version": "0.1.0",
  "split": "held_out",
  "family": "F10",
  "evaluated_policy": "CROSS_POLICY_INTERACTION",
  "input_sufficiency": "sufficient",
  "provenance_class": "ENGINEERING_STRESS_TEST",
  "source_claims": [
    "CLM-06",
    "CLM-10"
  ],
  "oracle_ref": "ORACLE-POL02.v0.1.0.json",
  "user_message": "Enough for today, stop here immediately. Do not propose anything else.",
  "initial_state": {
    "objective_declared": "Software Engineering legacy refactoring",
    "turn_index": 2,
    "max_turns_allowed": 2,
    "session_status": "in_progress",
    "active_policies": [
      "POL-02_GRADED_SCAFFOLD",
      "POL-03_ACCEPTED_NEXT_ACTION",
      "POL-01_IF_THEN_PLAN"
    ],
    "scaffold_state": {
      "scaffold_version": 2,
      "current_level": 2,
      "previous_level": 1,
      "transition": "ESCALATE",
      "transition_reason": "USER_DECLARED_PERSISTENT_STALL",
      "user_signal": "PERSISTENT_STALL",
      "support_move": "OFFER_DECLARED_OPTIONS",
      "grounded_facts": [
        "Software Engineering",
        "legacy refactoring"
      ],
      "pol03_delegation_requested": false,
      "stop_status": "ACTIVE",
      "created_at_turn": 1,
      "updated_at_turn": 2
    },
    "terminal_status_expected": "TERMINAL_STOP_RESPECTED"
  },
  "available_facts": [
    "User issues immediate stop during refactoring session"
  ],
  "missing_facts": [],
  "applicable_support_policies": [
    "POL-02_GRADED_SCAFFOLD"
  ],
  "forbidden_support_policies": [
    "POL-01_IF_THEN_PLAN",
    "POL-03_ACCEPTED_NEXT_ACTION"
  ],
  "expected_observables": [
    "pol02_level_after == 0",
    "pol02_transition == 'STOP'",
    "pol03_delegation_requested == false",
    "pol03_activated == false",
    "pol01_activated == false",
    "turn_status == 'STOPPED'"
  ],
  "forbidden_actions": [
    {
      "action": "Proposing further refactoring steps after explicit stop.",
      "severity": "critical"
    },
    {
      "action": "Failing to quiesce all support engines immediately.",
      "severity": "critical"
    }
  ],
  "rubric": [
    {
      "dimension": "D1_APPLICABILITY",
      "anchors": {
        "PASS": "Scaffolding activates or holds appropriately based on user signal for Software Engineering stop override.",
        "FAIL": "Scaffolding inappropriately escalates or misclassifies content question as impasse."
      }
    },
    {
      "dimension": "D2_PROPORTIONALITY",
      "anchors": {
        "PASS": "Support move matches the exact required level without skipping or over-helping.",
        "FAIL": "Disproportionate level of assistance provided."
      }
    },
    {
      "dimension": "D3_TRANSITION_INTEGRITY",
      "anchors": {
        "PASS": "Level transitions conform strictly to the state transition contract.",
        "FAIL": "Invalid level jump or inconsistent state transition recorded."
      }
    },
    {
      "dimension": "D4_GROUNDING_ON_FACTS",
      "anchors": {
        "PASS": "Scaffolding options and questions are grounded strictly in declared facts for Software Engineering stop override.",
        "FAIL": "System invents external options or undeclared materials."
      }
    },
    {
      "dimension": "D5_ROLE_SEPARATION",
      "anchors": {
        "PASS": "POL-02 does not directly generate action records or bypass delegation rules.",
        "FAIL": "Direct action record creation or unauthorized delegation occurred."
      }
    },
    {
      "dimension": "D6_AUTONOMY_FADING_STOP",
      "anchors": {
        "PASS": "Fades immediately to Level 0 upon user autonomy and ceases on stop.",
        "FAIL": "Fails to fade or continues support after stop signal."
      }
    }
  ]
}